{
  "version": 3,
  "status": "ERROR",
  "summary": {
    "errors": 4,
    "warnings": 10,
    "metrics": {
      "missingIds": 0,
      "drift": 0,
      "shadow": 0,
      "bannedNear": 4,
      "duplicates": 4,
      "scope": 6,
      "locale": 0
    },
    "versionMismatch": false,
    "computed_hash": "10c03b7fc7c7543399d1c2ce9bf121ec5e7fb46ddee876b286fdadde035089d0",
    "ruleCounts": {
      "DISC-PHRASE-009": 4,
      "DISC-DUPL-005": 4,
      "DISC-SCOPE-006": 6
    },
    "presence_enforcement": true
  },
  "errors": [
    {
      "code": "DISC-PHRASE-009",
      "file": "README.md",
      "severity": "ERROR"
    },
    {
      "code": "DISC-PHRASE-009",
      "file": "docs\\integrity\\credential-schema-final-v1.md",
      "severity": "ERROR"
    },
    {
      "code": "DISC-PHRASE-009",
      "file": "docs\\faq\\faq-fairness-hysteresis-update.md",
      "severity": "ERROR"
    },
    {
      "code": "DISC-PHRASE-009",
      "file": "docs\\governance\\dec\\DEC-20250812-02-hysteresis-adoption.md",
      "severity": "ERROR"
    }
  ],
  "warnings": [
    {
      "code": "DISC-DUPL-005",
      "page": "landing",
      "id": "D1",
      "count": 5,
      "severity": "WARNING"
    },
    {
      "code": "DISC-DUPL-005",
      "page": "landing",
      "id": "D7",
      "count": 4,
      "severity": "WARNING"
    },
    {
      "code": "DISC-DUPL-005",
      "page": "landing",
      "id": "D2",
      "count": 3,
      "severity": "WARNING"
    },
    {
      "code": "DISC-DUPL-005",
      "page": "governance",
      "id": "D7",
      "count": 3,
      "severity": "WARNING"
    },
    {
      "code": "DISC-SCOPE-006",
      "page": "landing",
      "id": "D7",
      "severity": "WARNING"
    },
    {
      "code": "DISC-SCOPE-006",
      "page": "credential_viewer",
      "id": "D5",
      "severity": "WARNING"
    },
    {
      "code": "DISC-SCOPE-006",
      "page": "credential_viewer",
      "id": "D1",
      "severity": "WARNING"
    },
    {
      "code": "DISC-SCOPE-006",
      "page": "credential_viewer",
      "id": "D7",
      "severity": "WARNING"
    },
    {
      "code": "DISC-SCOPE-006",
      "page": "governance",
      "id": "D7",
      "severity": "WARNING"
    },
    {
      "code": "DISC-SCOPE-006",
      "page": "governance",
      "id": "D1",
      "severity": "WARNING"
    }
  ],
  "config_effective": {
    "min_similarity": 0.9,
    "noise_similarity": 0.15
  }
}